
============================================
RESULTS FOR: Cost-Sensitive J48 (10-Fold CV)
Evaluation Method: 10-Fold Cross-Validation
Cost Matrix Used: [0, 1.0; 3.0, 0] (3:1 FN:FP)
============================================
Model Building Run-time: 402 ms

Results Summary

Correctly Classified Instances        7795               77.95   %
Incorrectly Classified Instances      2205               22.05   %
Kappa statistic                          0.559 
Mean absolute error                      0.2395
Root mean squared error                  0.4397
Relative absolute error                 47.8983 %
Root relative squared error             87.944  %
Total Number of Instances            10000     

Detailed Class Performance:

                 TP Rate  FP Rate  Precision  Recall   F-Measure  MCC      ROC Area  PRC Area  Class
                 0.628    0.069    0.901      0.628    0.740      0.587    0.815     0.829     No
                 0.931    0.372    0.715      0.931    0.809      0.587    0.815     0.754     Yes
Weighted Avg.    0.780    0.221    0.808      0.780    0.774      0.587    0.815     0.791     

Confusion Matrix:

    a    b   <-- classified as
 3140 1860 |    a = No
  345 4655 |    b = Yes
Overall Accuracy: 77.95%

============================================
RESULTS FOR: Cost-Sensitive SMO (Test Set)
Evaluation Method: Test Set Evaluation
Cost Matrix Used: [0, 1.0; 3.0, 0] (3:1 FN:FP)
============================================
Model Building Run-time: 2130 ms

Results Summary

Correctly Classified Instances        1498               49.9333 %
Incorrectly Classified Instances      1502               50.0667 %
Kappa statistic                          0     
Mean absolute error                      0.5007
Root mean squared error                  0.7076
Relative absolute error                100.1333 %
Root relative squared error            141.5155 %
Total Number of Instances             3000     

Detailed Class Performance:

                 TP Rate  FP Rate  Precision  Recall   F-Measure  MCC      ROC Area  PRC Area  Class
                 0.000    0.000    ?          0.000    ?          ?        0.500     0.501     No
                 1.000    1.000    0.499      1.000    0.666      ?        0.500     0.499     Yes
Weighted Avg.    0.499    0.499    ?          0.499    ?          ?        0.500     0.500     

Confusion Matrix:

    a    b   <-- classified as
    0 1502 |    a = No
    0 1498 |    b = Yes
Overall Accuracy: 49.93%

============================================
RESULTS FOR: Cost-Sensitive IBk (Test Set)
Evaluation Method: Test Set Evaluation
Cost Matrix Used: [0, 1.0; 3.0, 0] (3:1 FN:FP)
============================================
Model Building Run-time: 8 ms

Results Summary

Correctly Classified Instances        1809               60.3    %
Incorrectly Classified Instances      1191               39.7    %
Kappa statistic                          0.2066
Mean absolute error                      0.3971
Root mean squared error                  0.5263
Relative absolute error                 79.4265 %
Root relative squared error            105.2528 %
Total Number of Instances             3000     

Detailed Class Performance:

                 TP Rate  FP Rate  Precision  Recall   F-Measure  MCC      ROC Area  PRC Area  Class
                 0.311    0.104    0.750      0.311    0.440      0.255    0.696     0.695     No
                 0.896    0.689    0.565      0.896    0.693      0.255    0.703     0.682     Yes
Weighted Avg.    0.603    0.396    0.657      0.603    0.566      0.255    0.699     0.688     

Confusion Matrix:

    a    b   <-- classified as
  467 1035 |    a = No
  156 1342 |    b = Yes
Overall Accuracy: 60.30%

============================================
RESULTS FOR: Cost-Sensitive SMO (Test Set)
Evaluation Method: Test Set Evaluation
Cost Matrix Used: [0, 1.0; 3.0, 0] (3:1 FN:FP)
============================================
Model Building Run-time: 2251 ms

Results Summary

Correctly Classified Instances        1498               49.9333 %
Incorrectly Classified Instances      1502               50.0667 %
Kappa statistic                          0     
Mean absolute error                      0.5007
Root mean squared error                  0.7076
Relative absolute error                100.1333 %
Root relative squared error            141.5155 %
Total Number of Instances             3000     

Detailed Class Performance:

                 TP Rate  FP Rate  Precision  Recall   F-Measure  MCC      ROC Area  PRC Area  Class
                 0.000    0.000    ?          0.000    ?          ?        0.500     0.501     No
                 1.000    1.000    0.499      1.000    0.666      ?        0.500     0.499     Yes
Weighted Avg.    0.499    0.499    ?          0.499    ?          ?        0.500     0.500     

Confusion Matrix:

    a    b   <-- classified as
    0 1502 |    a = No
    0 1498 |    b = Yes
Overall Accuracy: 49.93%

============================================
RESULTS FOR: Cost-Sensitive IBk (Test Set)
Evaluation Method: Test Set Evaluation
Cost Matrix Used: [0, 1.0; 3.0, 0] (3:1 FN:FP)
============================================
Model Building Run-time: 5 ms

Results Summary

Correctly Classified Instances        1809               60.3    %
Incorrectly Classified Instances      1191               39.7    %
Kappa statistic                          0.2066
Mean absolute error                      0.3971
Root mean squared error                  0.5263
Relative absolute error                 79.4265 %
Root relative squared error            105.2528 %
Total Number of Instances             3000     

Detailed Class Performance:

                 TP Rate  FP Rate  Precision  Recall   F-Measure  MCC      ROC Area  PRC Area  Class
                 0.311    0.104    0.750      0.311    0.440      0.255    0.696     0.695     No
                 0.896    0.689    0.565      0.896    0.693      0.255    0.703     0.682     Yes
Weighted Avg.    0.603    0.396    0.657      0.603    0.566      0.255    0.699     0.688     

Confusion Matrix:

    a    b   <-- classified as
  467 1035 |    a = No
  156 1342 |    b = Yes
Overall Accuracy: 60.30%
